{
  "run_id": "run-fixture-53-3",
  "timestamps": {
    "started_at": "2026-09-13T16:00:00.000Z",
    "ended_at": "2026-09-13T16:02:00.000Z"
  },
  "tree_revision": "50504e52e9161bdb87811420eafde31d72f46a67",
  "guards": [
    {
      "stage": "verify",
      "name": "pytest tests/unit/test_track.py",
      "result": {
        "returncode": 0,
        "resolvable": true
      }
    }
  ],
  "gates": [
    {
      "name": "confidence",
      "rule": "confidence below 0.80 → human review",
      "verdict": "pass"
    },
    {
      "name": "scope_check",
      "rule": null,
      "verdict": "clean"
    }
  ],
  "model_adapter": null,
  "human_approvals_overrides": [],
  "retention": {
    "track": "indefinite",
    "raw_payload_days": 90
  }
}
